Text,True_Sentiment,Score,vader_pred,roberta_pred,distilbert_pred,vader_pos,roberta_pos
"Kettle brand chips are probably the best potato chips I've tasted thus far. They are thick, has a bite to them and I love their creative flavors. My favorite Kettle chip happens to be the honey Dijon. I think it's a great combination sweet, salty and tangy, perfect for one of those snack attacks when you don't know exactly what you want. I especially love the curled up chips for extra texture and crunch. These 2-oz bags are perfect for anyone who has a problem controlling portions (like me!).",Positive,5,Positive,Positive,Positive,0.311,0.9755265116691589
"These Kettle Brand potato chips in the Spicy Thai flavor really do taste like food I have eaten at a Thai restaurant. The ingredients listed include garlic powder, onion powder, parsley, jalapeno, and ""spices."" I'm not sure what other spices there are, but it sure tastes like lemongrass to me...yum. These chips are thick cut and very crunch. They come in a seriously heavy-duty bag. I tried to open it like I do regular chip bags by pulling the two sides apart; no way! The bag is so thick I wondered if it was plastic. I started looking for the scissors and decided that any company that put their chips in a bag this nice must have provided a way to open it. Sure enough, there is a small slit on the top and the simple directions ""tear here."" So easy. Why didn't I think of that.",Positive,4,Positive,Neutral,Negative,0.147,0.5114838480949402
"I've used maybe half a dozen bags of this tea in the last year and it is a delicious, consistently good quality black tea. Mainly I use it and several other Numi teas in my tea blends for making kombucha.",Positive,5,Positive,Positive,Positive,0.189,0.9724538922309875
"These chips taste awesome. And unlike most other flavored chips, they actually make sure that plenty of the flavory salty goodness gets on each individual chip. Just don't pass gas near any pretty ladies after consumption. They'll totally know it was you.",Positive,5,Positive,Positive,Positive,0.249,0.9543434381484985
Refer to the picture I posted above.  The bar is half the size you think it is going to be...It is literally a two-bite bar.  Very deceptive advertising.  That and the fact that they are ridiculously expensive is the reason for the one star.  My 10 year old son ate one and didn't like them. I ate one and agreed as did my husband.  Couldn't give it away!  Everyone has different tastes but these are no tasty treat as far as I'm concerned.,Negative,1,Positive,Negative,Negative,0.059,0.0
"A great healthy chew for my 9 wk old beagle, Rio. He loves the taste and it sure beats my arm.",Positive,5,Positive,Positive,Positive,0.46,0.9831047654151917
This is a real good product.I love these chips and so does my customers can't go wrong wit these the best,Positive,5,Positive,Positive,Positive,0.464,0.9854406714439392
I love this candy.  After weight watchers I had to cut back but still have a craving for it.,Positive,5,Positive,Positive,Positive,0.143,0.9210254549980164
"I have never been a huge coffee fan. However, my mother purchased this little machine and talked me into trying the Latte Macciato. No Coffee Shop has a better one and I like most of the other products, too (as a usually non-coffee drinker!).<br />The little Dolche Guesto Machine is super easy to use and prepares a really good Coffee/Latte/Cappuccino/etc in less than a minute (if water is heated up). I would recommend the Dolce Gusto to anyone. Too good for the price and I'am getting one myself! :)",Positive,5,Positive,Positive,Positive,0.267,0.9404876232147217
these are the best chips out there.. nothing can beat this taste. if you like honey mustard then you will definitely like this.. once you eat it you wont stop..addicting stuff,Positive,5,Positive,Positive,Positive,0.306,0.9797717928886414
"I don't know if it's the cactus or the tequila or just the unique combination of ingredients, but the flavour of this hot sauce makes it one of a kind!  We picked up a bottle once on a trip we were on and brought it back home with us and were totally blown away!  When we realized that we simply couldn't find it anywhere in our city we were bummed.<br /><br />Now, because of the magic of the internet, we have a case of the sauce and are ecstatic because of it.<br /><br />If you love hot sauce..I mean really love hot sauce, but don't want a sauce that tastelessly burns your throat, grab a bottle of Tequila Picante Gourmet de Inclan.  Just realize that once you taste it, you will never want to use any other sauce.<br /><br />Thank you for the personal, incredible service!",Positive,5,Positive,Positive,Negative,0.137,0.9375926852226257
"I've tried a variety of Ahmad tea. Not because I particularly like this brand, but they are just easier to come across.  The Imperial blend, I believe, is the most complex yet well balanced of all the ones I've tried. It's full body like a good cup of Assam, which by no means overpower the delightful, clean taste of Darjeerling, complete with a long lasting note of bergamot. I enjoy it best in the evening. It gives a satisfying and relaxing finish to a busy day.<br /><br />For those interested in the specifics: I use about 3 teaspoons of lose tea in a stainless steel infuser in a 16 oz mug, let it steep in 208F water for 2-3 min, take the infuser out, and drink it without sugar or milk to savor its sophistication.",Positive,5,Positive,Positive,Positive,0.266,0.9302878379821777
"Royal Canin was recommended for my dog, but since this line of dog food is specific to breed, it was difficult to find in stores.  PetsMart and Petco carried the Cocker Spaniel formula but only in smaller bags which is much more expensive on a per ounce ratio.  Finding a larger bag has been a great deal.  My cocker loves the food too!",Positive,5,Positive,Positive,Negative,0.173,0.437698632478714
"The energy shot truly does work! It had a terrible after-taste at first, but now that I know what to expect, I am getting used to it. I always have some water handy as a chaser...which helps! I am so glad to have found something that gives me the energy I need without all the chemicals found in other beverages. It's helped me kick my addiction to Diet Coke and other aspartame-laced caffeinated beverages. Yay!!!",Positive,4,Positive,Positive,Positive,0.239,0.8853867053985596
"I roast at home with a stove-top popcorn popper (but I do it outside, of course). These beans (Coffee Bean Direct Green Mexican Altura) seem to be well-suited for this method. The first and second cracks are distinct, and I've roasted the beans from medium to slightly dark with great results every time. The aroma is strong and persistent. The taste is smooth, velvety, yet lively.",Positive,4,Positive,Positive,Positive,0.143,0.8304126858711243
"These chips are VERY GOOD!! I couldn't stop eating them. They didn't last very long.<br /><br />The reason I gave them 4 stars, instead of 5, is because I think the bags are a little hard to open. I'm not sure why they need to make a potato chip bag that sturdy, you may need some scissors on hand to open them much easier.",Positive,4,Positive,Positive,Negative,0.203,0.8451653718948364
"we have fed our cats a lot of stuff. These 2 boy cats are not picky eaters. They loved the Purina. They loved the Nutro. They loved the Iams. They love whatever we feed them.<br /><br />This review is based on what we, their affectionate owners love. After a certain age, we were instructed by the vet to consider senior foods- and lower carb foods, because the catties were fatties. We tried a few types of food. Some evinced no change. Some made the litter super-stink.  Some had too small a kibble and the cats barfed it up because they didn't have to chew it to swallow it...<br /><br />This Felidae has done the trick. No problems to speak of. It is consistent in the litter and bearable on the nose. The cats love it. The kibble is sized appropriate to chewing. And here's the kicker:<br />After feeding the cats Felidae, their demeanor improved. Their coats are super soft and lush- both are new improvements we can directly attribute to this food. We're now loyal Felidae consumers.<br /><br />Additionally, the absence of corn product in the feed seems to lessen or remove the reactions of our friends with cat-allergies.",Positive,5,Positive,Positive,Negative,0.194,0.725858747959137
"Kettle chips are thicker and crunchier (though greasier at times) than other chips, and the honey dijon flavor is great.  They don't have the overwhelming salty taste some cheaper chips have, and the 2oz size is great for an adult size snack.",Positive,5,Positive,Positive,Positive,0.17,0.9421038031578064
"I bought these chips, and wanted to try if they were tasty. It sure is!  Unique and different flavor and the right thickness.<br /><br />It remains crunchy, spicy and flavorful with a hint of tabasco and paprika sauce for heat. There are some rice granules embedded with the tortilla chips. However, some of the spices are lacking from this chip. But I liked this very much.<br /><br />I would recommend this to anyone who wants to try a red beans and rice tortilla chips. Go ahead-- you can put other ingredients as nachos except the cheese.  Maybe some el pastor, shredded meat, tomatoes, etcetera.",Positive,5,Positive,Positive,Positive,0.084,0.9705052971839905
"I really like this product and taste great with the coffee or tea, and I have lost weight by cutting the sugar and replacing it with the honey and Agave nectar.",Positive,5,Positive,Positive,Negative,0.193,0.9771572947502136
"Pocky is an incredibly good snack, but more than that, I was impressed with Very Asia's packaging. I had stupidly ordered something as easy to melt as chocolate in the dead heat of summer. On top of that the package of dessert pocky I ordered in 100 degree weather melted into this liquid goo. T_T So of course I was expecting all the pocky in my 10 boxes to be melted away, but they took the special care to put the pocky in a box reading ""PROTECT FROM HEAT"" and my pocky arriving in perfect condition! (Well, they did stick together just a bit). I love Very Asia more than anything now.",Positive,5,Positive,Positive,Positive,0.256,0.758778989315033
"These Albanese gummi bears and rings and so on are very good and tasty and high quality. The bears even have little faces. At my local candy store this type of gummi stuff (bears, rings, snakes, balls, worms, whatever) are about $10/lb. These twin packs of 4.5 or 5 pound bags is a screaming deal as far as I'm concerned. I'm probably 50 pounds deep in these friggin' things. Consumed!",Positive,5,Positive,Positive,Negative,0.048,0.8851950764656067
"Kettle Brand chips used to be so good...oily, crunchy, flavorful. I suspect the company has been bought out and the recipe has been changed for the worse. Now they're no better than any other big name brand chip. Try the Good Health Kettle Style Olive Oil chips instead. They are as good as the Kettle Brand once was. R.I.P., Kettle Brand chips. :(",Negative,1,Negative,Negative,Positive,0.117,0.0
"I first bought pickled asparagus at an Amish market and it was love at first bite. Hence, when I saw these on the discount rack at the local Safeway I cleaned it out.  These are even better than the ones from the Amish market. They are fantastic, and some of the jars have a bonus clove of garlic at the bottom. I'm going to order the six pack and I'm a household of one. They wont go to waste!",Positive,5,Positive,Positive,Positive,0.196,0.9725243449211121
"But if you happen to, like me, there is no better sea salt and vinegar chip I've found in this country.",Positive,5,Positive,Positive,Negative,0.254,0.0
If you love jalapeno chips then Kettle is a must try.<br />Nice and cruncy with the kick of jalapeno.<br />Delicious.<br />Addicting.<br />Recommended.,Positive,5,Positive,Positive,Negative,0.174,0.9567670226097107
"I can honestly say this is the worst frosting we have ever bought. It's kind of generous to call it frosting, it has more the consistency of rubber cement. And since we were in a time crunch, we didn't have the luxury of going back out to the store for a different frosting, so we forged ahead and decorated a cake with it. Horrible experience, bad enough to put us off cake decorating forever. It spread about as easily as chewing gum, stuck to everything it came in contact with, and got crumbs of the cake mixed up in it. On top of all this, it didn't even taste good. By the time we were done decorating, we knew there was no way we could feed this mess to our family. So we ended up going to the store anyway to buy a pre-made cake. Our cake, which took twice as long to decorate because this stuff is so gooey, was used as a centerpiece. A really ugly centerpiece, that cracked and peeled as the frosting dried.",Negative,1,Negative,Negative,Negative,0.053,0.0
"I was looking for a natural energy shot that works, and I found it. Steaz energy shot is my favorite!<br /><br />I recently had gastric bypass surgery, so tons of sugar is a no-no. And I'm also allergic to Sucralose (Splenda) so most other energy drinks are out.<br /><br />I tried Bazi energy shots and they didn't work as well as Steaz, and definitely didn't taste as well. These have a taste that's almost like Coca-Cola--not bad at all.<br /><br />If you're looking for natural energy, give these a try.",Positive,5,Positive,Positive,Negative,0.205,0.8803593516349792
I bought these for my husband and he said they are the best energy shots out there. He takes one in the mornings and works hard all day. Good stuff!,Positive,5,Positive,Positive,Positive,0.264,0.9808293581008911
"I like ""Vernor's"", and drink it all the time. It is old fashioned drink from Michigan, since 1866, and the labeling was known for its lovely green and gold colors and the gnome character. If you look at the can it is actually called ginger soda instead of ale and is different than typical ginger ale in taste. Vernors has a strong vanilla presence, is smoother and more moist, and sweeter than a ginger ale. It is closer to a cream soda than ginger ale, very good. A ginger ale is more dry, higher in carbonation, and has a spicier bite to it. Vernors has 39 grams sugar per can, versus 33 grams per can for Schweppes Ginger Ale. Neither has caffeine.<br /><br />The recipe has changed a bit over the years mostly in the choice of sweeteners. They use the same high fructose corn syrup that the cost-cutting mega soda companies use, rather than the cane sugar they used to use. The down side to that is that the corn syrup syrup drowns out some of the flavors. Many microbrews are using cane sugar again, although it costs more, to get a better taste. Vernor's is still aged in oak barrels for 3 years, no doubt accounting for the smoothness. All in all a great soda for anytime. The soda is also known, like other ginger drinks, for its use as a home remedy for an upset stomach.<br />Vernor's is a regional soda, and there are many areas of the country you can't find it in. That is why it sells here. They may be selling it in glass bottles again soon, at least there is a page that says so the day I am writing this comment. Search at Amazon for ASIN: B001JK2SEG to see what I mean. Vernors has quite a history, and there are two books at Amazon about the soda. The first is Vernor's Ginger Ale (Images of America: Michigan) ISBN-10: 0738551856. The second book is ""The Vernor's Story: From Gnomes to Now"" ISBN-10: 0472066978 a book about the company's marketing green and gold packaging with the famous gnome, and Vernor's fans.",Positive,5,Positive,Positive,Negative,0.071,0.9399276375770569
"I ordered this for my wife as it was reccomended by our daughter.  She has this almost every morning and likes all flavors.  She's happy, I'm happy!!!<br /><a href=""http://www.amazon.com/gp/product/B001EO5QW8"">McCANN'S Instant Irish Oatmeal, Variety Pack of Regular, Apples & Cinnamon, and Maple & Brown Sugar, 10-Count Boxes (Pack of 6)</a>",Positive,5,Positive,Positive,Positive,0.144,0.9825724363327026
"Package arrived DOUBLE boxed, wrapped, and the inside box(that holds the goods) perfect not a single dent or rough mark, outstanding packaging.<br /><br />The Product?<br /><br />These are the best chips on the planet, Salt 'N Vinegar flavor is beyond among the best chips I've ever had. You might, actually I'm sure you probably won't like it AT FIRST BITE 'IF' you have never had these before. But try it again.<br /><br />Not to mention, this particular flavor has held up in numerous surveys and comparisons against other manufactures.",Positive,5,Positive,Positive,Positive,0.123,0.9400045275688171
"You HAVE to try the VANILLA Tootsie Rolls!  The regular chocolate ones are good, but THESE are the BEST EVER!!",Positive,5,Positive,Positive,Positive,0.351,0.980263888835907
"thesedon't like hot food they might be a bit much for you. They have a great balance of sweetness and spice. Of course, Kettle Chips are just good chips - they use good oil to make them and even the plain ones are tasty. I also like that they are ridged chips - those are usually too crunchy and hard to chew for me - I don't want to have to work that hard for my deliciousness. If you like spicy barbecue you will definitely like these chips.",Positive,5,Positive,Positive,Positive,0.188,0.7509298920631409
"For those of us on a low carb diet these little tablets are just the thing.<br /><br />Two years ago I started cycling again after many years but was having heart arrhythmia after longer rides in high heat.  I was drinking plain water but did a little research and thought electrolytes might be the issue.  Gatorade wasn't an option because it is so loaded with carbohydrates so I looked around for a low-carb alternative.  The ""zero carb"" sports drinks didn't help so what to do?  One day I ran across these at my bike shop so tried a tube of them.....voila!...problem solved!!<br /><br />I've shared them with two friends in particular whose problems with leg cramps were resolved while using these.<br /><br />These guys got it right -- they are superbly formulated and simply work.....",Positive,5,Positive,Neutral,Negative,0.073,0.0
"Can't say anything bad about Sugar in the Raw.  I like it better than the other ""natural"" sugars. Better consistency and - I know it doesn't matter - but better color. Unfortunately, one of the ""natural"" paper bags got torn a bit in the box.  It didn't look like the box was damaged so I can't tell how it happened, but it was sort of pain to clean up half a bag that spilled all over the inside of the box and our kitchen when I opened it.  Not sure what the solution is and I'd order it again, but if it happens again, I'd switch to one of the brands that ship in an unnatural plastic bag.",Positive,4,Positive,Neutral,Negative,0.157,0.0
"I purchased the Mango flavor, and to me it doesn't take like Mango at all.  There is no hint of sweetness, and unfortunately there is a hint or aftertaste almost like licorice.  I've been consuming various sports nutrition products for decades, so I'm familiar and have come to like the taste of the most of the products I've tried.  The mango flavor is one of the least appealing I've tasted.  It's not terrible, but it's bad enough that I notice the bad taste every sip I take.",Negative,2,Negative,Negative,Negative,0.041,0.0
"service was great, but I meant to buy Swiss Chalet chicken SAUCE not the Marinade :)<br /><br />Love the sauce - have yet to try the marinade",Positive,5,Positive,Positive,Negative,0.096,0.9026404619216919
They are good but wish they were also baked. Have not found baked no salt potato chips anywhere. If there are any I wish someone would post.,Positive,4,Positive,Neutral,Negative,0.341,0.0
"Not hot at all. Like the other low star reviewer, I got suckered by seeing 'habenero' in the name and the 12 oz size. Some people might like the flavor, citrus-y and it has some fish sauce in the mix (according to the ingredient label), but if you're looking for hot this ain't it",Negative,1,Neutral,Negative,Negative,0.062,0.0
We like these chips for salsa and quacomole better than any other cips on the market. They are even great by themselves. We will order these as long as they are available. Thank you for making them accessable.<br /><br />  Shelly Kenyon,Positive,5,Positive,Positive,Positive,0.24,0.9778467416763306
"My bottle arrived just in time for a sushi dinner and game night planned with friends.  I had three soy sauces to choose from.  After some sampling we were all using the Bluegrass!  Everyone enjoyed the light smoothness a subtle sweetness.  We were splashing right on every piece, rather that dunking/dipping. Friends wanted to know where I found it. I'm going back to order more right now, and I'll be ordering 3 extra bottles because they are going to make a great little gift that's affordable and unique; instead of the traditional bottle of wine that so common it's boring.",Positive,5,Positive,Positive,Positive,0.18,0.9251900911331177
"Even though we are International Delight fans we were not completely dissapointed by this product. We had no problem with the shipment, but the creamer itself is thinner than International Delight. Other than that we are happy :D",Positive,4,Positive,Positive,Negative,0.342,0.9029639363288879
"I have been using porcini mushrooms in my cooking for twenty plus years. The Roland extra fancy porcinis that I purchased from you are the best that I have ever used, including the mushrooms that I bought in Italy and transported back to the USA.",Positive,5,Positive,Positive,Positive,0.095,0.9639928340911865
"OK,I did read the reviews which ranged from splendid to awful. I took the plunge as I do like salty, and tangy flavors. No, I had never had these before I took the leap and ordered a case at a super price. They arrived quickly and in great shape with the sell by date  FEB 2011. Umm, I'm in the middle on these chips, they are OK but not something I can't live without. I love the crunch, the color, NO TRANS FAT. They are a little too vinegary for my taste, which is a lot coming from a kid that grew up eating pickled hard-boiled eggs and pickled pigs feet.<br /><br />I haven't tried them with a deli sandwich and a cold mug of beer which might improve the experience :)",Neutral,3,Positive,Positive,Positive,0.164,0.6128998398780823
"I first discovered Kettle Chips with sea salt and vinegar while shopping at Trader Joe's with my daughter Mindy.  I couldn't believe how tasty they were; the best chip I had ever eaten.  It was love at first bite, and I've been munching them ever since.<br /><br />Other things in their favor: they're thicker than other chips, so don't crumble as I'm devouring them; they're delightfully crunchy; and the salt-and-vinegar combination is heavenly.  I tried to create an original line to describe this palate-pleasing taste treat, but couldn't beat what the manufacturer said: tongue-puckering tang and crunch.  Isn't that poetic?<br /><br />As for health values, since Kettle Chips are not peeled during preparation, I'm getting more nutrition, such as potassium and vitamin C.  My mother would approve of that, and the fact that they're hand-cooked in small batches.<br /><br />I often enjoy Kettle Chips as an afternoon snack with my favorite soda or iced tea, but they're also delicious with a tuna sandwich or a hot dog for lunch.  Well, actually Kettle Chips go perfect with everything ... except ""sweets,"" of course.<br /><br />My only problem is that they're so delicious I can't stop eating them.  That's the reason I chose these smaller packets; I figured 24 could last me almost a month, if I was a good girl, kept my appetite under control--and hid them from the kids!  For the sake of fewer calories, I try hard and have succeeded so far.  It isn't easy, but ...<br /><br />Have I told you how much I love them?<br /><br />Reviewed by: Betty Dravis, 2008<br />Millennium Babe: The Prophecy",Positive,5,Positive,Positive,Positive,0.217,0.9770550727844238
"A friend who'd been drinking tea for 80 of his 84 years introduced me to this tea a few months ago. Even took me over to the store and bought me a pound. At $7/lb. in a retail store or a little over $9 with shipping from an online merchant, I think it's great. I've been drinking Earl Grey, English Breakfast, Irish Breakfast, Lapsang Souchong, Assam, etc. Most of them were over $30/lb. with shipping. Aside from the Lapsang Souchong, I think this is a great replacement for all the rest. Has everything I'm looking for in a strong, full-bodied black tea with enough character to keep it from becoming boring. My current favorite afternoon tea. Unless you're extremely jaded or a tea snob, you'll love it.",Positive,5,Positive,Positive,Negative,0.167,0.9258647561073303
"These cookies were fun to paint but not too tasty to eat!<br />The kids did not really care much, but it might have been<br />more fun if they could have eaten them.<br /><br />They really had fun coloring them!",Positive,4,Positive,Positive,Negative,0.231,0.9295825958251953
"These are the strongest tasting salt and vinegar chips I've had.  I could still do with more vinegar flavor, but I think this is as close as I'm going to get without dousing them with vinegar powder myself.<br /><br />I did a side by side with the Cape Cod salt and vinegar and these are about twice as flavorful.  Additionally, as other reviewers have said, they have quite a good bit of potassium in them (somewhere in the neighbor of 15% RDA per serving).",Positive,5,Positive,Positive,Positive,0.074,0.9222737550735474
