Text,True_Sentiment,Score,vader_pred,roberta_pred,distilbert_pred,vader_pos,roberta_pos
"These things are just too darn cheesy. If you like a lot of flavor, you'll love these. Otherwise, you will overdose on their cheddary goodness.",Neutral,3,Positive,Negative,Negative,0.316,0.0
"I love Cherrybrook Kitchen and have tried almost all of their products.  I was excited to try the Ready to Spread frosting, as I do not usually keep the needed ingredients on hand for their box frosting.  I am not a picky eater, especially if the item contains sugar... but this was horrible!  The consistency is absolutely nothing like regular canned frosting.  It is not light and fluffy.  It is very gooey.  I cannot even imagine trying to spread it on a cake - it would rip it to pieces because it is so thick and gooey.  I did not even try it on a cake, because the taste and texture were so off-putting.  Seriously, do not waste your money!",Negative,1,Negative,Positive,Negative,0.095,0.8101329207420349
"I recently purchased this on sale at my local grocery store... now I know why it was on sale!<br /><br />This is not a fluffy, creamy white frosting you'd expect to find when opening the jar. Now, I wasn't expecting it to be just like Betty Crocker, but it was pretty bad. Like others said, it is a gluey/tacky mess that would completely ruin a cake if you tried to spread it on.  It reminds me of taffy that hasn't quite hit the right stage in the candy making process.  The taste isn't that great either, and it's sickeningly sweet (even for frosting).  The only thing it might be used for is a frosting for cinnamon buns?  I still don't think it would be the right consistency...",Negative,1,Negative,Negative,Negative,0.091,0.0
"I love using this to sweeten tea, coffee, etc. It tastes much better than other low glycemic sweeteners - there is no bitter aftertaste.",Positive,5,Positive,Positive,Positive,0.228,0.9815110564231873
"i love this product cant find it locally. Sometimes little out of the way stores have it.But i also love the chicken,pork chop bags.Every store i go in i look for them the lastplace i found it was at a meat market.",Positive,5,Positive,Positive,Positive,0.198,0.9098583459854126
"I love these chips. The flavor is not plain. They are sweet and spicy all at the same time.  The only drawback is it has a tad bit too much salt. But, it still a great flavor!",Positive,4,Positive,Positive,Positive,0.254,0.948574960231781
"For those who love salt and vinegar potato chips, this is the one to choose. The flavor is zippy and tart, with no unpleasant chemical aftertaste like the less ""natural"" versions of this snack. The 2-ounce bags are just right to share at lunch. The chips are a little greasy, and that's why I've given them 4 stars instead of 5.",Positive,4,Positive,Positive,Negative,0.13,0.8928337693214417
"TOTALLY ORGASMIC.  these chips are the best spicy chip i have ever tasted.  signed up for the subscribe and save option.  the case contained 15(FIFTEEN, FULL SIZED BAGS) OF CHIPS.  the price per unit equals $1.73  per package.  that is not even the cost of plain chips.  if you add the free shipping and the fast delivery, this deal is a steal.  so run like you stole something over to your computer and order the SPICY THAI CHIPS.  p.s.  even if you paid the going price of $30.00, you are still ahead of the curve.  ENJOY",Positive,5,Positive,Positive,Positive,0.16,0.9344168901443481
"I'm not sure how you review something that's as subjective as taste, but suffice to say that if you like chocolate and graham cracker, you'll like this (it doesn't taste exactly like either of those, but that's the closest analogy for me).  The sticks themselves are a cracker of some kind, dipped in chocolate, with one end left just normal cracker to you don't get your fingers covered in chocolate while eating.<br /><br />Here's some of the nitty gritty details - each of the boxes contain two individually sealed packets, that contain probably 20 or so of the sticks.  The packets themselves are really cleverly designed, with a little slit cut in the folded part, you just grab both sides and pull, and it opens up the package without any hassle - gotta love Japanese product design!  :)  Another nice design touch is that when you open it properly the grabbing-side of the stick is right at the top.<br /><br />Each of the packets has 210 calories (90 from fat), and about 80mg of sodium - so in terms of snacks this is a pretty good option.  It does contain milk, wheat, soybeans and sheanut - so if any of these are an issue for you, then you'll want to pass.  It also says on the packaging that the facility they're manufactured in also processes eggs and peanuts - the product doesn't use either of them, but the disclosure is nice if you're particularly sensitive to either.<br /><br />Overall a great snack at a great price - the 10 pack really is 20 of the packets, so that's quite a few snacks.  One note, if you live in a hot climate, don't order them in the summer because they will melt together (in shipping)!  Duh!  :)",Positive,5,Positive,Neutral,Positive,0.187,0.0
"The BEST investment I've ever made for ginger. It's unbelievable! It's fibrous like the real ginger, has that spicy kick to it, but it's perfect with the sugar - calms it down.  It's very worth the $40 for 5lbs of it!  I'll be getting more soon - I use these as a topper for my ginger cupcakes and cookies :)",Positive,5,Positive,Positive,Negative,0.305,0.9744222164154053
The holiday liquor cups were exactly what I was looking for.  The chocolate is<br />delicious and holds up well to the liquors,Positive,5,Positive,Positive,Positive,0.202,0.9800866842269897
"These looked like a perfect snack to through in with my trail mix.  Unfortunately, they arrived in a solid mass of melted chocolate.  I left them in my pantry for a few days, and when I opened them at room temperature they were still gooey.  I through them in the fridge and I've been breaking off hunks ever since.  They taste good to me, but the chocolate is all grainy after melting and then solidifying again.  I won't order them online again, but if I see them in a store I would pick them up.",Positive,5,Positive,Negative,Positive,0.083,0.0
I think these chips are awesome if not the best along with Poor Brothers Salt and Vinager chips. But if you buy these Spicy Thai chips in a smaller bag it might have too much of the flavor (at the bottom of the bag) in it then the larger bag at least that was my experience last time I bought these off amazon but that was like in 2010. So I would suggest trying Spicy Thai in a bag bigger then 5 ounces.,Positive,4,Positive,Positive,Negative,0.093,0.6078553199768066
"I am a coffee fanatic but have always stayed away from these because I never liked instant coffee and my assumption was that this would be similar.  I really enjoy the Starbucks VIA instant coffee - but I drink so much, it is rather expensive so I thought I would give this a try.  Both my wife and I were pleasantly surprised with the taste.  I don't think it equals fresh brewed but it is very acceptable.  I bought my first 38 pack at my local grocery store for about $7.  That seemed a little high but I figured I would check online to find the best price.  As I started calculating all of the online prices, they are charging about $7 bucks for the 19 count.  I would suggest that you check your local grocery stores as you might be able to find it cheaper.  So you don't have to do the math...$7 / 38 = .184 per single.  Online price $27 / 114 = .236 (shipping not calculated in).  Looking at a supposed discount coffee supplier, you can get a case of 12 boxes for $69, no sales tax and free shipping...sounds like a great deal??  12 x 19 = 228 singles so $69 / 228 = .302 per single - the most expensive at all.",Positive,5,Positive,Positive,Negative,0.168,0.5493221879005432
"My daughter is outgrowing baby food but will still eat this.  We tried 3rd foods on her and she doesn't like the texture of them.  This is really good for her and she likes it, so we keep buying it.",Positive,5,Positive,Positive,Positive,0.168,0.8450915813446045
"Both our twins love this one right from the start but it's not loaded with lentils (see ingredients below).  We introduced it when they were 7 months old and now they're 10 months.  I'm glad they are eating something green because we couldn't get them to eat the one with peas when we tried at 7 months, but we got them to eat the peas later at 9 months.<br /><br />Their favorite vegetable is sweet potato and we've also tried sweet potato with cinnamon. They love all the fruit varieties.<br /><br />I'm glad they love this one because lentils and brown rice form a complete protein, although a view of the ingredients shows that lentils is not one of the prime ingredients.<br /><br />This one also has carrots and I've heard all babies like carrots.  I don't know if they would like it without the carrots.  I haven't seen this one - lentils and brown rice - in our local stores, so I'm glad to get it here. Along with some others, we get this one with the subscription.  Of course, with twins one is forced to buy more in bulk and we're so busy that it's great to get these delivered.<br /><br />The packaging is excellent.  I've ordered an unbelievable number of cases of jars of different types and only had one jar arrive broken.<br /><br />Ingredients per label: Water, organic apples, organic carrots, organic brown rice, organic lentils, organic canola oil.<br /><br />This has 70 calories, 10% protein, 100% vitamin A, 4% vitamin C, 2% calcium and 4% iron.<br /><br />I'm informed that the daily intake percentage is based on an adult.",Neutral,3,Positive,Positive,Negative,0.205,0.9553834795951843
"I found these crisps at our local WalMart & figured I would give them a try. They were so yummy I may never go back to regular chips, not that I was a big chip fan anyway. The only problem is I can eat the entire bag in one sitting. I give these crisps a big thumbs up!",Positive,5,Positive,Positive,Negative,0.127,0.9593673944473267
"Tasty, convenient bars for people with celiac disease. They seem to have gotten smaller over time, but the taste and convenience outweigh the reduction in size (and the price).",Positive,4,Neutral,Positive,Negative,0.0,0.7689037919044495
"This item, WERTHER'S SUGAR FREE HARD CANDY, if consumed, will give you - or your friends, loose bowels. I purchased 12 bags and discovered more than a bowel problem: You can't return them. Need a laxative? I have ten unopened bags you can have - for free.",Negative,1,Positive,Negative,Negative,0.197,0.0
"Use frequently as we like to do Asian dishes at least once a week.  Love this product.  Fast shipping, as usual.  Would buy again.",Positive,5,Positive,Positive,Negative,0.242,0.9756367802619934
These are better in England. I don't know why. Maybe it's just nostalgia on my part.,Neutral,3,Positive,Neutral,Negative,0.172,0.47082552313804626
I used to love these growing up and stopped drinking water and lemon juice from this brand about 5-6 years ago. This stuff used to be so strong i used to just pour some in my mouth and get that alive feeling going. It feels like the product went through changes which added more water or something to make it not so strong. The stronger it is the less you use as well. The product is still really good but the taste is the same quality as the cheaper brand names almost. I thought  these would go fast but hey all lemon stuff i love unless it goes bad. This is a good product just wish it still had that hit me in the mouth chug sensation it used to be like.,Positive,4,Positive,Positive,Negative,0.237,0.4925898313522339
Green Mountain is my favorite brand. Nantucket is my favorite coffee from Green Mountain. Very smooth flavor. Not too strong and not too weak.,Positive,5,Positive,Positive,Positive,0.27,0.974716067314148
"Kettle brand chips are very crunchy.  I would say regular plain old Lays potato chips are at the ""soft"" end of the ""soft/crunchy"" spectrum.  Ruffles brand potato chips used to be considered the crunchiest, but Kettle brand chips are far more crunchy.  If you have a tender mouth or bad teeth (dentures) you might want to steer clear of Kettle brand.  Otherwise, you'll love these chips.  The Sea Salt & Vinegar chips are super TANGY.  I enjoy taking swigs of vinegar bottles from time to time.  I am dissapointed with all other Salt & Vinegar chips either because the chips are too soft and/or the vinegar taste whimpy and/or chemically.  Rest assured Kettle Sea Salt & Vinegar has a gourmet flavor.  The vinegar flavor has no chemical flavor and could NEVER be called whimpy!",Positive,5,Positive,Neutral,Negative,0.16,0.0
"I started my cat on Felidae Platinum about 3 weeks ago and she loves it. She's an older cat, somewhat overweight, and had a grouchy temperament. I first mixed it with her previous food and she figured out which was which -- she ate the Felidae and left the old food! She's now been on just the Felidae for about ten days now, off the old food entirely, and she is a much sweeter, happier cat. I think it must agree with her better or be more easily digested, or something. In any case, I am a happy purchaser of Felidae. I don't agree with the previous reviewer that cats don't like it. Clearly, mine does.",Positive,5,Positive,Positive,Positive,0.171,0.915114164352417
"The taste of these white cheddar flat breads is like a regular cracker - which is not bad, except that I bought them because I wanted a cheese taste.<br /><br />What was a HUGE disappointment? How misleading the packaging of the box is. The photo on the box (I bought these in store) makes it look like it is full of long flatbreads (expanding the length and width of the box). Wrong! The plastic tray that holds the crackers is about 2"" smaller all around - leaving you with about 15 or so small flatbreads.<br /><br />What is also bad about this is that the company states they use biodegradable and eco-friendly packaging. FAIL! They used a HUGE box for a ridiculously small amount of crackers. Not ecofriendly at all.<br /><br />Would I buy these again? No - I feel ripped off. The other crackers (like Sesame Tarragon) give you a little<br />more bang for your buck and have more flavor.",Negative,2,Negative,Negative,Negative,0.098,0.0
"Arrived slightly thawed. My parents wouldn't accept it. However, the company was very helpful and issued a full refund.",Positive,4,Positive,Neutral,Positive,0.145,0.0
My poland spring driver gave us this new tea to try and<br />our family really enjoyed it. I looked at the ingredients and was quite pleased<br />with the natural ingredients and no calories.,Positive,5,Positive,Positive,Positive,0.163,0.9773300886154175
"Baby loved this one, but as he has progressed I had to cut this one out because it is too runny and if I have to move the spoon quickly out of the way of his grabby hands, it is all over! I think they could use a little less water maybe a little more potato to make it more the consistency of the turkey dinner one.",Positive,4,Negative,Negative,Negative,0.037,0.0
I just wanted to post here that I found small bits of plastic in this food as I was feeding my 9 month old.  Plastic!!! in food!!!! baby food!!!  So please be careful if you buy this or are considering it.<br /><br />My daughter LOVES this food-- it's actually her favorite.  This is the first time we have noticed plastic in it in over 2 months.,Negative,1,Positive,Neutral,Negative,0.186,0.0
"This product is amazing. I know a few people with little ones that use these and they LOVE them!! Super easy to clean and use. When ordering these, I was under the impression that there were 2 per package...FYI-they're not!! Only one per...",Positive,4,Positive,Positive,Positive,0.392,0.9500755071640015
"My son has had acid reflux since birth and has been on every medication available with no improvement, Until an older gentleman came into his work place and told him about this product and I automatically ordered it for him. I was really not expecting any better results than the 1000 other things we have tried. What a surprise! He has not had any heartburn or symptoms since day 2 of starting eating one piece of this Ginger each morning. He can now eat anything and actually enjoy it. This product was a God send for him. Thank you all for it!",Positive,5,Positive,Positive,Positive,0.125,0.44837144017219543
"I Was sent 3 week past ""Fresh by date"" stock. Chips are noticeably not fresh in taste. Won't order again.<br /><br />EDIT: And just to add to the dangers of expired stock one of the bags had a rat hole in it, black marks on inside of hole very obviously rat. unfortunately I put a chip in my mouth before I saw the hole.<br /><br />Very bad form amazon.",Negative,1,Negative,Negative,Negative,0.055,0.0
"I don't write very many reviews but I have to say that Kettle Brand chips are the best I have ever tasted.  Every flavor is dynamite.  If you are feeling iffy about honey dijon, I would recommend cheddar beer, absolutely amazing.  And they're healthy!  (besides a lil fat)  I have eaten a lot of chips in my day and Kettle takes the cake.  Enjoy, and don't eat them too fast.",Positive,5,Positive,Positive,Positive,0.322,0.9638565182685852
"When we received our Keurig Elite for Christmas, we were so excited to break open the sample pack of pods to try out different blends and flavors. Of the 12 pods we had in the box, four were Green Mountain Coffee brand. I'd never tried anything from this company before, but from what I had researched online, they have the largest range of Keurig pods and have even bought out competitors to produce coffee under their brand names as well.<br /><br />Unfortunately, I was immediately disappointed by the quality of the coffee. We tried their Dark Magic, Decaf and Breakfast Blend and all were underwhelming, to say the least. I was almost completely set on writing off Green Mountain altogther.<br /><br />We had one GM pod left and being of the mindset of waste-not-want-not, I figured I'd give it one last go around before forgetting about them completely. And I'm glad I did.<br /><br />The Nantucket Blend is a perfectly pleasing cup of coffee. It is nice and flavorful without being thick and pungent (unlike some of the other GM blends we tried). I added some flavored creamer to it and it almost measures up to our go-to Caribou Blend pods. Almost. All in all, this is a very standard cup of coffee which, while it isn't anything new or exciting, is very pleasing and definitely one of the better Keurig options we've been able to test out. When we run out of all the pods we've accumulated, I'll probably pick up a box of these as well.<br /><br />Now that I know Green Mountain isn't completely disappointing I'll definitely be open to trying a few more of their coffees (with our promotion for getting the bewer we ordered <a href=""http://www.amazon.com/gp/product/B004I3Y4IE"">Green Mountain Coffee Golden French Toast,  K-Cup Portion Pack for Keurig K-Cup Brewers, 24-Count</a> to try as well) and see how it goes from there.<br /><br />If you're looking for a go-to choice, this is your cup!",Positive,4,Positive,Positive,Positive,0.128,0.9240207672119141
These mints are really strong and have a great taste. They are also a convenient size to carry in a pocket or purse.,Positive,5,Positive,Positive,Positive,0.299,0.9831609129905701
"At first you think that these chips aren't all that Spicy, but the spice will grow on you with each bite.  They are really very good!",Positive,5,Positive,Positive,Positive,0.167,0.9580596089363098
"I have found this product, Kettle Chips Unsalted to be fabulous.  I found them by accident on Amazon after hunting all over my local stores.  They are crisp and tasty without all of the salt.",Positive,5,Positive,Positive,Positive,0.134,0.9737967848777771
"I liked getting this one for my twin 10-month olds because it has such interesting ingredients, particularly the zucchini and the garbanzo beans.  I like the fact that it's vegetarian yet I believe it has a complete protein since it also has brown rice.  This list of ingredients looks excellent and it's a green color naturally.<br /><br />The babies liked it.  They have liked everything that has carrots.<br /><br />I have the subscription for this one as I really like the ingredients and the fact that I'm giving the babies food that is naturally green.<br /><br />Ingredients per the label: Water, organic corn, organic zucchini, organic green beans, organic brown rice, organic carrots, organic garbanzo beans, organic canola oil.<br /><br />This has 70 calories, 8% protein, 40% vitamin A, 10% vitamin C, 2% calcium and 2% iron.  I've been informed that the percentage of daily needs met is based on an adult.",Neutral,3,Positive,Positive,Positive,0.164,0.979249894618988
"Halloween is over but, I sent a bag to my daughters class for her share. The chocolate was fresh and enjoyed by many.",Positive,5,Positive,Positive,Positive,0.362,0.9112072587013245
"Besides the obvious convenience and portability of the individual creamers, I liked this item specifically because of packaging. I couldn't believe how many reviews I read about coffee creamer cups; but many of the Amazon creamer options (both Coffeemate and International Delight) had multiple negative reviews due to the shipment arriving with broken cups thanks to sloppy packaging.<br /><br />That was not an issue here. The shipment arrived in four dispensing boxes of 50 each (as shown in the photo); those boxes were tightly packed in a thick cardboard box which could take a good beating before damaging the inner boxes. Thus, none of my cups were broken, no waste and no sloppy drippy mess. Plus the four boxes means I could put one in the kitchen, one in the bathroom (we moved our mini Keurig there when we upgraded the kitchen Keurig - best idea my husband ever had), and one at work, with a reserve for whichever runs out first.<br /><br />If you are looking for these mini creamers but deterred like I was by the negative packaging reviews on other options, this is your best bet. As a bonus, the auto delivery price is very reasonable.",Positive,5,Negative,Positive,Negative,0.129,0.8170901536941528
"My 1-1/2 year old basenji/jack russell mix loves this dog food. He's been noticeably healthier and more energetic since I switched him over from the standard dog foods earlier this year. Despite the higher cost of natural dog foods, I find that he eats significantly less of the Natural Balance dog foods and still stays happy and full. On the normal dog foods, he'd eat up to 3 cups of dog food a day (the recommended serving for his size), whereas he only eats about 1 cup to 1-1/2 cup of the Natural Balance dog food a day. When you take this into account, you're actually getting more ""bang for your buck"" with the natural dog foods since you don't have to buy as much to last just as long as the normal dog foods... and a healthier, happier dog, to boot! Add in the fact that you can get free, 2-day shipping with Amazon Prime... I'm sold!!",Positive,5,Positive,Positive,Positive,0.182,0.9293888211250305
I wouldn't even think of buying this product unless I know the price per unit. How can I compare other items online or in a store?,Negative,1,Neutral,Negative,Negative,0.0,0.0
"I don't think these coffee bags are as good as fresh ground fresh brewed coffee, but they taste far better than instant coffee.  At work, we have a water cooler with hot water dispenser.  This brewed in hot water just like a tea bag making tea tastes far better than any instant coffee.  I highly recommend it to any coffee lover when you have access to very hot water but don't have access to a coffee maker.  Individual wrapped and sealed bags allow you to take one tiny tea like bag with you in your pocket or purse to your early morning meetings.",Positive,4,Positive,Positive,Positive,0.259,0.8542200326919556
"I first found Steaz Berry Energy Shots at a local organic market. I bought two bottles, which cost just under three dollars each. I fell in love instantly. The drink is delicious -- I can taste the yerba mate and the acai juice, like a slightly bitter fruity chocolate honey tea. I am very sensitive to sucralose (Splenda) which is in so many energy drinks these days; I also hate the taste. I love that Steaz has actual sugar and no artificial sweeteners. The rush it gives me is slow and even. I have several medical conditions, including fibromyalgia, which saps me of energy and causes intense pain. I like how Steaz helps clear away the fatigue and fog so I can get things done. No caffeine jitters, even though there are 150 mg of caffeine in each bottle.<br />It was becoming expensive for me to buy the bottles separately at stores, so I started looking online for a bulk price. I am so thrilled to have found the Pack Of 12 on Amazon. I signed up for Amazon Prime specifically for this product, hah!",Positive,5,Positive,Positive,Positive,0.187,0.9329695105552673
"Please ignore the one-star comments, if you check the bag the main ingredient IS in fact whole grain brown rice and the second is rice flower. With anything that is gluten free you have to add another ""binder"" which is where the corn flour comes in. For someone who has celiac disease and cannot have Sunchips, because they contain wheat (a key binder to any chip, cookie or cereal) this is an excellent product. My spouse and I buy these a lot because they are gluten free and absolutely delicious!",Positive,5,Positive,Neutral,Positive,0.167,0.0
I love the fact that there is turkey being offered. This is my son's 2nd favorite dish. No issues with it and a good balance of nutrients.,Positive,5,Positive,Positive,Positive,0.303,0.9767988920211792
